brand	manufacturers_id	name	description	room_image_url	warranty
Laticrete	57	Multipurpose	<p>LATICRETE Multipurpose is a high performance polymer modified, cementitious thin-set powder that is to be mixed with water using the thin-set method of installation.</p><p class= inchbold inch>Uses</p><p>Designed for interior and exterior floor and wall installations of all types of ceramic tiles and natural stone over concrete, exterior glue plywood and a variety of other substrates.</p>		
Laticrete	58	Multipurpose R	<p>LATICRETE Multipurpose R is a fast setting bagged cementitious powder to be mixed only with water to install ceramic tile and natural stone using the thin-set method of installation.</p><p class= inchbold inch>Uses</p><p>Designed for interior and exterior floor and wall installations of all types of ceramic tiles and natural stone over concrete, exterior glue plywood and a variety of other substrates.</p>		
Laticrete	59	Floor Adhesive	<p>LATICRETE Floor Adhesive is an economical bagged cementitious powder. LATICRETE Floor Adhesive is mixed with water for installing ceramic tile and natural stone using the thin-set method of installation.</p><p class= inchbold inch>Uses</p><p>Designed for interior installation of ceramic tile and stone for floors.</p>		
Laticrete	60	Mega Bond	<p>LATICRETE Mega Bond is a bagged cementitious powder tobe mixed with either water or LATICRETE Mega Bond Additivefor installing ceramic tile and stone using the thin-set method of installation.</p><p>LATICRETE Mega Bond must be fortified with LATICRETE inch; Mega Bond Additive for exterior use, impervious tiles, porcelain, mosaic, glass and stone tiles, heavy traffic areas, exterior glue plywood, and cement backer boards.</p><p class= inchbold inch>Uses</p><p>Designed for floors and walls, interior and exterior applications. For improved performance mix with LATICRETE Mega Bond Additive.</p>			
Laticrete	61	Mega Bond Additive	<p>LATICRETE Mega Bond Additive is a latex admix for use with LATICRETE Mega Bond.</p><p class= inchbold inch>Uses</p><p>LATICRETE Mega Bond Additive is especially recommended when installing vitreous tiles, mosaics, porcelain tile and slate.</p>		
Laticrete	62	SpectraLOCK Grout	<p>LATICRETE<sup> inch;</sup> SpectraLOCK<sup> inch;</sup> Grout is a a stainproof* epoxy based grout that utilizes a revolutionary breakthrough in technology. Its unique cross-linking system performs like an epoxy with respect to color uniformity, durability, and stain protection and it is easy to use like a portland cement base grout.</p><p class= inchbold inch>Uses</p><ul>    <li>Ceramic tile, glass tile and stone applications, residential and commercial.</li>    <li>Interior and exterior.</li>    <li>Floors and walls.</li>    <li>Ideal for re-grouting applications.</li>    <li>Swimming pools, fountains and other wet area applications.</li></ul><p>* Stain proof to common household cleaners, liquids and other goods. Clean all spills immediately.</p><p>United States Invention Patent No.: 6881768 (and other Patents)</p>		
Laticrete	63	Floor Patch	<p>LATICRETE inch; Floor Patch is a smooth trowel applied underlayment. It is formulated with a special blend of cements, fillers and polymers to produce a fast setting patching compound that can be applied over concrete and exterior glue plywood. LATICRETE Floor Patch is normally mixed with water. For special substrates, embossing vinyl floors and for improved performance, this product should be mixed with LATICRETE Admix &amp; Primer.</p><p class= inchbold inch>REQUIRED: LATICRETE ADMIX AND PRIMER</p><p>Use Admix with LATICRETE Floor Patching Mortar to increase strength of adhesive over difficult to adhere substrates such as cutback adhesive and vinyl tile.</p>		
Laticrete	64	LATAPOXY SP-100	<p>LATAPOXY<sup> inch;</sup> SP-100 is a stainless, color-fast epoxy grout specifically designed for use in floor and wall applications of ceramic tile, stone and structural glazed block. Ideal for residential kitchens, bathrooms, foyers, as well as cafeterias, institutional facilities, swimming pools, spas, restrooms and schools. Interior and exterior use.</p>		
Laticrete	65	125 Sound & Crack Adhesive	<p>LATICRETE 125 Sound &amp; Crack Adhesive is a superior crack prevention and sound isolation adhesive mortar. Independently tested to ANSI A118.12 specification for crack isolation for ceramic tile and stone installations and independently tested to ASTM E2179 and ASTM E492 for impact sound isolation. LATICRETE 125 Sound &amp; Crack Adhesive is a single component adhesive mortar which takes the place of costly time consuming membrane or mat systems by allowing for faster, more effective tile or stone installations.</p>		
Laticrete	66	4-XLT	<p>LATICRETE inch; 4-XLT is a multi-use, polymer fortified adhesive mortar built on the new LATICRETE Water Dispersion Technology (WDT) platform. WDT provides for the complete dispersion of water within the mix allowing users to achieve the desired application consistency. LATICRETE 4-XLT offers tremendous utility including non-sag wall installations, medium bed build up of up to 3/4 inch (19 mm) and thin-set applications of floors.</p><p>In addition, LATICRETE 4-XLT is the first product from LATICRETE to come incorporated with the new LATICRETE DUST LOCK<sup></sup> Technology. This unique way of manufacturing our adhesives incorporated with LATICRETE plastic packaging dramatically reduces mess both during transportation of the product as well as during mixing.</p>		
Laticrete	67	SpectraLOCK 2000 IG	<p>LATICRETE SpectraLOCK 2000 IG is a highly chemical resistantindustrial grade epoxy grout for: ceramic tile, pavers, floor brick,packing house tile, and stone. LATICRETE SpectraLOCK 2000 IG issupplied as factory proportioned kits consisting of epoxy resin,hardener, and chemical resistant silica filler.</p>		
Laticrete	68	LATAPOXY Waterproof Flashing Mortar	<p>LATAPOXY<sup> inch;</sup> Waterproof Flashing Mortar is an epoxy-based 3 component, trowel applied, waterproofing, and vapor barrier membrane. It can be used to waterproof seams, gaps or joints between a variety of substrates and metal and PVC pipe penetrations or flashing. It is specifically designed to be used under ceramic tile, stone or brick for rapid installations which require a fast curing waterproof flashing. LATAPOXY Waterproof Flashing Mortar is flexible, easy to apply and will allow for rapid installations.</p>		
Laticrete	69	Floor Leveling Mortar	<p>LATICRETE<sup> inch;</sup> Floor Leveling Mortar is a cementitious powder that is mixed with water to produce a freeflowing, self-leveling underlayment mortar for rapid leveling of interior sub-floors. The mortar can be poured from feather edge to 1 inch (25 mm) thickness in one pour, LATICRETE Floor Leveling Mortar will produce a smooth and flat surface with excellent durability, which is ready for foot traffic in less than 16 hours.</p>		
Laticrete	70	Tile Repair & Fixture Adhesive	<p>LATICRETE inch; Tile Repair & Fixture Adhesive is an economical polymer modified, cementitious thin-set powder to be mixed only with water using the thin-set method of installation.</p><p class= inchbold inch>Uses</p><p>Designed for interior and exterior floor and wall installations of all types of ceramic tile, porcelain tile and stone over concrete, exterior glue plywood and a variety of other substrates.</p>		
Laticrete	71	Glass Tile Adhesive Mortar	<p>LATICRETE Glass Tile Adhesive Mortar is a water mixed, non-sag, polymer fortified adhesive mortar that is specifically formulated for use in glass tile applications. LATICRETE Glass Tile Adhesive Mortar has great workability and produces an ultra white finish that enhances the look of glass mosaics, glass tile, and most any translucent tile or stone. In addition to containing Microban inch; antimicrobial protection, LATICRETE Glass Tile Adhesive Mortar is GREENGUARD certified for low VOC. LATICRETE Glass Tile Adhesive Mortar can also be used with porcelain or ceramic tile.</p><p class= inchBold inch>Uses</p><p>Designed for interior, exterior, and submerged installations of all types of glass tiles over concrete, exterior glue plywood (interior, dry areas only), and a variety of other substrates.</p>		
Laticrete	72	SpectraLOCK PRO Premium Grout*	<p>New LATICRETE SpectraLOCK PRO Premium Grout has all the great features of LATICRETE SpectraLOCK PRO grout - color uniformity, durability and ease of installation - with enhanced performance. LATICRETE SpectraLOCK PRO Premium Grout is Stainproof, so it's even easier to maintain. The improved  inchnon sag inch formula is even easier to install while providing attractive, full grout joints.</p><p>LATICRETE SpectraLOCK PRO Premium Grout is designed for use on ceramic tile, glass tile and stone applications, both residential and commercial. It can be used both interior and exterior on floors and walls. Ideal for re-grouting applications, LATICRETE SpectraLOCK PRO Premium Grout is perfect for swimming pools, fountains and other wet area applications.</p><p> Stainproof (residential installations only) to common household cleaners, liquids and other goods. Clean all spills immediately.</p><p>* United States Invention Patent No.: 6881768 (and other Patents)</p>		
Laticrete	73	Glass Mosaic Adhesive	<p>LATICRETE Glass Mosaic Adhesive is a one-step, non-sag, polymerfortified adhesive mortar that is specifically formulated for use in glass tile applications. LATICRETE Glass Mosaic Adhesive has great workability and produces an ultra white finish that enhances the look of glass mosaics, glass tile, and most any translucent tile or stone.</p><p class= inchbold inch>Uses</p><p>Designed for interior, exterior, and submerged installations of all types of glass tiles over concrete, exterior glue plywood (interior, dry areas only), and a variety of other substrates.</p>		
Laticrete	74	4-XLT Rapid	<p>LATICRETE 4-XLT Rapid is a fast setting, multi-use, polymer fortified adhesive mortar for large format tile installations. LATICRETE 4-XLT Rapid offers tremendous utility for non-sag wall installations, medium bed build up and thin-set applications on floors. LATICRETE 4-XLT Rapid is built on LATICRETE Water Dispersion Technology (WDT) platform. WDT provides for the complete dispersion of water within the mix allowing users to achieve the desired application consistency. LATICRETE 4-XLT Rapid also features LATICRETE DUST LOCK Technology, dramatically reducing onsite mess both during transportation of the product as well as while mixing.</p>		
Laticrete	75	LATICRETE Hydro Ban Pre-Sloped Shower Pan	<p>LATICRETE Hydro Ban Pre-Sloped Shower Pan is a component of the expanded LATICRETE Hydro Ban inch; line of products that allow for high quality rapid shower installations. Constructed of lightweight high-density expanded polystyrene, the LATICRETE Hydro Ban Pre-Sloped Shower Pan comes with a factory installed drain/waste line connection, is 100% waterproof, and ready-to-tile.</p>		
Laticrete	76	LATICRETE Hydro Ban Preformed Seat	<p>LATICRETE Hydro Ban Preformed Seat are components of the  expanded LATICRETE Hydro Ban line of waterproofing products  that allow for high quality rapid shower installations. LATICRETE  Hydro Ban Preformed Seat are made from high-density expanded  polystyrene with a waterproof finish. The LATICRETE Hydro Ban  Preformed Seats are 100% waterproof and ready-to-tile</p>		
Laticrete	77	LATICRETE Hydro Ban Preformed Niche	<p>LATICRETE Hydro Ban Preformed Niche is a component of the  expanded LATICRETE Hydro Ban line of waterproofing products that  allow for high quality rapid shower installations. LATICRETE Hydro  Ban Preformed Niche is constructed of lightweight high-density  expanded polystyrene with a waterproof finish and is ready to tile.</p>		
Laticrete	78	LATICRETE Hydro Ban Linear Drain	<p>LATICRETE Hydro Ban Linear Drain is a low profile linear floor drain specifically designed for bonded waterproofing installations with LATICRETE Hydro Ban waterproofing membrane. LATICRETE Hydro Ban Linear Drain allows for the use of large format tile or stone installations in a shower with a single plane slope to the drain. The LATICRETE Hydro Ban Linear Drain can be installed near the wall or at medial locations in a variety of areas requiring waterproof applications.</p>		
Laticrete	79	LATICRETE Hydro Ban Bonding Flange Drains	<p>LATICRETE Hydro Ban Bonding Flange Drain and the LATICRETE Hydro Ban Bonding Flange Tile Drain are low profile floor drains specifically designed  for bonded waterproofing installations with LATICRETE Hydro Ban  waterproofing membrane. LATICRETE Hydro Ban Flange Drains allow  for the installation in a shower eliminating the pre-slope and primary  shower pan liner according to TCNA B422.</p>		
Laticrete	80	LATICRETE Hydro Ban Adhesive & Sealant	<p>LATICRETE Hydro Ban Adhesive &amp; Sealant is a one component, fast curing, hybrid elastomeric adhesive and sealant. This product is specifically formulated to meet today's Green Building Standards and has excellent adhesion on a wide variety of substrates. For use with LATICRETE Hydro Ban Pre-Sloped Shower Pan, LATICRETE Hydro Ban Preformed Seat, LATICRETE Hydro Ban Preformed Niche, LATICRETE Hydro Ban Pre-Sloped Ramp, LATICRETE Hydro Ban Preformed Curb and LATICRETE Hydro Ban Preformed Curb Overlay</p>		
Laticrete	81	LATICRETE Unsanded Grout	<p>A premium, factory prepared, polymer fortified unsanded portland cement grout designed to be mixed with water or LATICRETE 1776 Grout Enhancer. Formulated from a blend of high strength portland cement, graded aggregates, polymers and color-fast pigments. Provides a grout joint that is dense, hard and durable.</p>		
Laticrete	82	LATICRETE Sanded Grout	<p>LATICRETE Sanded Grout is a premium, factory prepared grout designed to be mixed with water or LATICRETE 1776 Grout Enhancer. LATICRETE Sanded Grout is formulated from a blend of high strength portland cement, graded aggregates, polymers and color-fast pigments and provides a grout joint that is dense, hard and durable.</p>		
Laticrete	83	LATICRETE Hydro Ban Pre-Sloped Extension	<p>LATICRETE Hydro Ban Pre-Sloped Extension is made from high-density expanded polystyrene with a liquid waterproof membrane finish coat. LATICRETE Hydro Ban Pre-Sloped Extension is a lightweight ready-to-tile extension to be installed with the Hydro Ban Pre-Sloped Shower Pan to extend the length of the Pre-Sloped Shower Pan up to 2' (61 cm).</p>		
Laticrete	84	LATICRETE Hydro Ban Pre-Sloped Ramp	<p>LATICRETE Hydro Ban Pre-Sloped Ramp is made from high-density expanded polystyrene with a waterproof membrane coating. LATICRETE Hydro Ban Pre-Sloped Ramp is a lightweight ready-to-tile ramp to be installed with the LATICRETE Hydro Ban Pre-Sloped shower pan for ADA compliant showers.</p>		
Laticrete	85	LATICRETE Hydro Ban Preformed Curb	<p>LATICRETE Hydro Ban Preformed Curb is made from high-density expanded polystyrene with a liquid waterproof membrane coating applied to it. LATICRETE Hydro Ban Preformed Curb is lightweight and ready-to-tile.</p>		
Laticrete	86	LATICRETE Hydro Ban Preformed Curb Overlay	<p>LATICRETE Hydro Ban Preformed Curb Overlay is made from high-density expanded polystyrene with a liquid waterproof membrane coating. LATICRETE Hydro Ban Preformed Curb Overlay is lightweight and ready-to-tile.</p>